{
  "schemaVersion": "0.1.0",
  "id": "9cb87ea8-ebc6-9406-ac7e-33ab19a4c406",
  "layoutDocumentId": "d22467a3-7404-4f06-b19a-64972e36c1d9",
  "rootId": "f53f1ea7-6b27-9b78-0be3-c8259088b7d2",
  "nodes": [
    {
      "id": "f53f1ea7-6b27-9b78-0be3-c8259088b7d2",
      "kind": "DOCUMENT",
      "parentId": null,
      "children": [
        "22567273-0dec-ee00-599c-6a1626a8f399",
        "572163e4-c025-b93c-ee29-60febb63bef9",
        "2e8d0710-76df-42ab-56af-baf2b3981d06"
      ],
      "content": {
        "text": "",
        "marks": []
      },
      "attributes": {
        "layoutRegionIds": []
      },
      "confidence": {
        "score": 1.0,
        "reason": "document root"
      },
      "provenanceIds": ["ae30f9a8-8b11-a8db-acab-ac8b3523824b"]
    },
    {
      "id": "22567273-0dec-ee00-599c-6a1626a8f399",
      "kind": "FRONT_MATTER",
      "parentId": "f53f1ea7-6b27-9b78-0be3-c8259088b7d2",
      "children": [
        "d36fa1d0-f05f-02ce-59c8-5f3941da4cc1",
        "445f20cb-3908-56d3-9606-b9b1dc1c9aea",
        "218ff812-1158-e86a-5ff3-b646fe2e1087"
      ],
      "content": {
        "text": "",
        "marks": []
      },
      "attributes": {
        "layoutRegionIds": []
      },
      "confidence": {
        "score": 0.65,
        "reason": "page-1 title block"
      },
      "provenanceIds": ["ccfa6610-2b7e-e840-40fe-0015c80717aa"]
    },
    {
      "id": "d36fa1d0-f05f-02ce-59c8-5f3941da4cc1",
      "kind": "HEADING",
      "parentId": "22567273-0dec-ee00-599c-6a1626a8f399",
      "children": [],
      "content": {
        "text": "Smoke Fixture",
        "marks": []
      },
      "attributes": {
        "layoutRegionIds": ["012abe65-714d-591f-2ed2-4e4797373ea1"],
        "level": 1,
        "role": "title"
      },
      "confidence": {
        "score": 0.6,
        "reason": "front matter title"
      },
      "provenanceIds": ["836829e6-84de-3647-6c79-9289c164cd63"]
    },
    {
      "id": "445f20cb-3908-56d3-9606-b9b1dc1c9aea",
      "kind": "PARAGRAPH",
      "parentId": "22567273-0dec-ee00-599c-6a1626a8f399",
      "children": [],
      "content": {
        "text": "Repository fixture",
        "marks": []
      },
      "attributes": {
        "layoutRegionIds": ["9055f921-3383-c4f3-0c5e-0e065581fd44"],
        "role": "author"
      },
      "confidence": {
        "score": 0.8,
        "reason": "front matter author"
      },
      "provenanceIds": ["aa9c492f-2f61-e992-7224-c6be1e984269"]
    },
    {
      "id": "218ff812-1158-e86a-5ff3-b646fe2e1087",
      "kind": "PARAGRAPH",
      "parentId": "22567273-0dec-ee00-599c-6a1626a8f399",
      "children": [],
      "content": {
        "text": "2026-09-03",
        "marks": []
      },
      "attributes": {
        "layoutRegionIds": ["6b9df2e8-e44e-223b-61ca-9eb5aaa734a3"],
        "role": "date"
      },
      "confidence": {
        "score": 0.8,
        "reason": "front matter date"
      },
      "provenanceIds": ["4131158e-aee5-e508-1e81-4b147532750c"]
    },
    {
      "id": "572163e4-c025-b93c-ee29-60febb63bef9",
      "kind": "PARAGRAPH",
      "parentId": "f53f1ea7-6b27-9b78-0be3-c8259088b7d2",
      "children": [],
      "content": {
        "text": "This fixture is the minimum LuaLaTeX regression document. Unicode: Café, naïve, Zürich. Math:",
        "marks": []
      },
      "attributes": {
        "layoutRegionIds": ["941c4f9d-a829-0e2d-54c5-1aa724075877"]
      },
      "confidence": {
        "score": 0.8,
        "reason": "layout text region"
      },
      "provenanceIds": ["af97d9a0-17a8-df4f-7c53-c08a75e9eb9a"]
    },
    {
      "id": "2e8d0710-76df-42ab-56af-baf2b3981d06",
      "kind": "EQUATION",
      "parentId": "f53f1ea7-6b27-9b78-0be3-c8259088b7d2",
      "children": [],
      "content": {
        "unicodeText": "E = mc2 .",
        "rawText": "E = mc2 ."
      },
      "attributes": {
        "layoutRegionIds": ["af751cad-ca69-1b7f-bdc2-cb5aebaa789f"]
      },
      "confidence": {
        "score": 0.55,
        "reason": "display equation: 1 regions"
      },
      "provenanceIds": ["b8d88cdf-cb41-ac94-d317-7af09a3e7be5"]
    }
  ],
  "relations": [],
  "provenanceIds": ["9ee03a5e-fadf-dd28-9f7a-c81782bb0323"],
  "provenance": {
    "records": [
      {
        "id": "9ee03a5e-fadf-dd28-9f7a-c81782bb0323",
        "producer": "pdf-pipeline.semantic",
        "producerVersion": "0.2.0",
        "operation": "semantic-recovery",
        "inputRefs": ["d22467a3-7404-4f06-b19a-64972e36c1d9"]
      },
      {
        "id": "ae30f9a8-8b11-a8db-acab-ac8b3523824b",
        "producer": "pdf-pipeline.semantic",
        "producerVersion": "0.2.0",
        "operation": "document-root",
        "inputRefs": ["d22467a3-7404-4f06-b19a-64972e36c1d9"]
      },
      {
        "id": "ccfa6610-2b7e-e840-40fe-0015c80717aa",
        "producer": "pdf-pipeline.semantic",
        "producerVersion": "0.2.0",
        "operation": "front-matter",
        "inputRefs": ["d22467a3-7404-4f06-b19a-64972e36c1d9"]
      },
      {
        "id": "836829e6-84de-3647-6c79-9289c164cd63",
        "producer": "pdf-pipeline.semantic",
        "producerVersion": "0.2.0",
        "operation": "heading-recovery",
        "inputRefs": [
          "012abe65-714d-591f-2ed2-4e4797373ea1",
          "59d71ba0-2c1c-082d-0681-d79b8b681208"
        ]
      },
      {
        "id": "aa9c492f-2f61-e992-7224-c6be1e984269",
        "producer": "pdf-pipeline.semantic",
        "producerVersion": "0.2.0",
        "operation": "paragraph-recovery",
        "inputRefs": [
          "9055f921-3383-c4f3-0c5e-0e065581fd44",
          "7cf68354-7576-28e2-b172-4757a0efb4fe"
        ]
      },
      {
        "id": "4131158e-aee5-e508-1e81-4b147532750c",
        "producer": "pdf-pipeline.semantic",
        "producerVersion": "0.2.0",
        "operation": "paragraph-recovery",
        "inputRefs": [
          "6b9df2e8-e44e-223b-61ca-9eb5aaa734a3",
          "85498f94-266f-3f5e-323e-b381c1e91ee4"
        ]
      },
      {
        "id": "af97d9a0-17a8-df4f-7c53-c08a75e9eb9a",
        "producer": "pdf-pipeline.semantic",
        "producerVersion": "0.2.0",
        "operation": "paragraph-recovery",
        "inputRefs": [
          "941c4f9d-a829-0e2d-54c5-1aa724075877",
          "9d0a3f02-93b9-c557-9b7f-fd627d52f0ec"
        ]
      },
      {
        "id": "b8d88cdf-cb41-ac94-d317-7af09a3e7be5",
        "producer": "pdf-pipeline.semantic",
        "producerVersion": "0.2.0",
        "operation": "equation-recovery",
        "inputRefs": ["af751cad-ca69-1b7f-bdc2-cb5aebaa789f"]
      }
    ]
  }
}
